Date,UserID,LogDescription
9/28/2016 15:47,David,Finished powershell log script
9/28/2016 16:45,David,renamed logbook.csv for easier script launch
9/28/2016 17:25,David,Changed logbook script to be CSV; and replace instring commas 
28/09/2016 18:39:03,Administrator,Testing scripts on PFSV1 server (use command powershell.exe -executionpolicy bypass -file ),
28/09/2016 19:20:10,Administrator,Changed SetExecutionpolicy on TestVM,
9/29/2016 9:08:37 AM,David,test for logbook,
9/29/2016 9:21:49 AM,David,IP table > added HyperV network,
9/29/2016 10:16:35 AM,David,Succesfully created user from script (individual),
